{
  "$schema": "https://metabuilder.dev/schemas/package-styles.schema.json",
  "schemaVersion": "2.0.0",
  "colors": {
    "analyzerPrimary": "#6366f1",
    "analyzerSecondary": "#8b5cf6",
    "uploadZoneBorder": "#d1d5db",
    "uploadZoneHover": "#e5e7eb",
    "resultSuccess": "#22c55e",
    "resultWarning": "#f59e0b",
    "resultError": "#ef4444",
    "infoLabel": "#6b7280",
    "infoValue": "#1f2937"
  },
  "spacing": {
    "containerPadding": "24px",
    "cardPadding": "16px",
    "sectionGap": "16px",
    "buttonGroupGap": "8px",
    "gridGap": "16px"
  },
  "shadows": {
    "card": "0 2px 8px rgba(0, 0, 0, 0.1)",
    "uploadZone": "0 1px 4px rgba(0, 0, 0, 0.05)",
    "imagePreview": "0 4px 12px rgba(0, 0, 0, 0.15)"
  }
}
