{
  "$schema": "https://metabuilder.dev/schemas/package-styles.schema.json",
  "schemaVersion": "2.0.0",
  "colors": {
    "optionEven": "#f9f9f9",
    "optionOdd": "#ffffff",
    "dragHandle": "#9e9e9e",
    "previewBorder": "#e0e0e0"
  },
  "spacing": {
    "cardPadding": "16px",
    "optionRowPadding": "8px",
    "gridGap": "16px"
  },
  "shadows": {
    "dropdownCard": "0 1px 3px rgba(0, 0, 0, 0.08)",
    "previewDialog": "0 4px 20px rgba(0, 0, 0, 0.15)"
  }
}
