{
  "$schema": "https://metabuilder.dev/schemas/package-styles.schema.json",
  "schemaVersion": "2.0.0",
  "colors": {
    "arcadePrimary": "#6366f1",
    "arcadeSecondary": "#8b5cf6",
    "arcadeAccent": "#f59e0b",
    "queueActive": "#22c55e",
    "queueWaiting": "#eab308",
    "queueFull": "#ef4444",
    "tournamentLive": "#ec4899",
    "tournamentUpcoming": "#3b82f6",
    "partyHighlight": "#14b8a6",
    "statPositive": "#28a745",
    "statNegative": "#dc3545",
    "statNeutral": "#6c757d"
  },
  "spacing": {
    "lobbyPadding": "24px",
    "cardGap": "16px",
    "gridGap": "16px",
    "sectionSpacing": "24px",
    "statCardPadding": "16px",
    "badgeGap": "8px"
  },
  "shadows": {
    "card": "0 2px 8px rgba(0, 0, 0, 0.1)",
    "cardHover": "0 4px 12px rgba(0, 0, 0, 0.15)",
    "statCard": "0 1px 4px rgba(0, 0, 0, 0.08)",
    "gameCard": "0 2px 6px rgba(99, 102, 241, 0.12)"
  },
  "borderRadius": {
    "card": "12px",
    "badge": "6px",
    "button": "8px",
    "progress": "4px"
  },
  "typography": {
    "lobbyTitle": {
      "fontSize": "1.5rem",
      "fontWeight": 700,
      "lineHeight": 1.2
    },
    "sectionTitle": {
      "fontSize": "1.25rem",
      "fontWeight": 600,
      "lineHeight": 1.3
    },
    "gameTitle": {
      "fontSize": "1.125rem",
      "fontWeight": 600,
      "lineHeight": 1.4
    },
    "statValue": {
      "fontSize": "1.25rem",
      "fontWeight": 600,
      "lineHeight": 1.2
    },
    "statLabel": {
      "fontSize": "0.875rem",
      "fontWeight": 400,
      "lineHeight": 1.4
    }
  }
}
